id,doi,title,year,authors,journal,abstract,provenance_databases,provenance_techniques,provenance_count,decision,decision_reason,screener,decision_date,calibration_set
arxiv:2512.09892v1,,Provably Learning from Modern Language Models via Low Logit Rank,2025,"Noah Golowich, Allen Liu, Abhishek Shetty",arXiv,"While modern language models and their inner workings are incredibly complex, recent work (Golowich, Liu &amp; Shetty; 2025) has proposed a simple and potentially tractable abstraction for them through the observation that empirically, these language models all seem to have approximately low logit rank. Roughly, this means that a matrix formed by the model's log probabilities of various tokens conditioned on certain sequences of tokens is well approximated by a low rank matrix. In this paper, our focus is on understanding how this structure can be exploited algorithmically for obtaining provable learning guarantees. Since low logit rank models can encode hard-to-learn distributions such as noisy parities, we study a query learning model with logit queries that reflects the access model for common APIs. Our main result is an efficient algorithm for learning any approximately low logit rank model from queries. We emphasize that our structural assumption closely reflects the behavior that is empirically observed in modern language models. Thus, our result gives what we believe is the first end-to-end learning guarantee for a generative model that plausibly captures modern language models.",arxiv,assumptive,1,,,marion,,1
arxiv:2511.06195v1,,"AI as intermediary in modern-day ritual: An immersive, interactive production of the roller disco musical Xanadu at UCLA",2025,"Mira Winick, Naisha Agarwal, Chiheb Boussema, Ingrid Lee, Camilo Vargas, Jeff Burke",arXiv,"Interfaces for contemporary large language, generative media, and perception AI models are often engineered for single user interaction. We investigate ritual as a design scaffold for developing collaborative, multi-user human-AI engagement. We consider the specific case of an immersive staging of the musical Xanadu performed at UCLA in Spring 2025. During a two-week run, over five hundred audience members contributed sketches and jazzercise moves that vision language models translated to virtual scenery elements and from choreographic prompts. This paper discusses four facets of interaction-as-ritual within the show: audience input as offerings that AI transforms into components of the ritual; performers as ritual guides, demonstrating how to interact with technology and sorting audience members into cohorts; AI systems as instruments ""played"" by the humans, in which sensing, generative components, and stagecraft create systems that can be mastered over time; and reciprocity of interaction, in which the show's AI machinery guides human behavior as well as being guided by humans, completing a human-AI feedback loop that visibly reshapes the virtual world. Ritual served as a frame for integrating linear narrative, character identity, music and interaction. The production explored how AI systems can support group creativity and play, addressing a critical gap in prevailing single user AI design paradigms.",arxiv,reciprocity,1,,,marion,,1
nct:NCT07036744,,When The Mirror Is Wrong: A Multi-Method Efficacy Study Of An Acceptance And Compassion-Based Group Intervention For Body Dysmorphia,2025,,ClinicalTrials.gov,"Body Dysmorphic Disorder (BDD) is a severe psychiatric condition characterized by persistent and intrusive preoccupations with perceived flaws in physical appearance, which are typically unnoticeable or appear minor to others. BDD is associated with significant psychological distress, functional impairment, and reduced quality of life. Despite its prevalence and clinical severity, BDD remains frequently underdiagnosed and misdiagnosed. While Cognitive Behavioural Therapy (CBT) and Selective Serotonin Reuptake Inhibitors (SSRIs) are currently considered standard treatments, emerging evidence suggests that third-wave psychotherapies, such as Acceptance and Commitment Therapy (ACT) and Compassion-Focused Interventions, may offer additional benefits.

This project aims to advance clinical care and scientific understanding of BDD by developing, implementing, and evaluating the preliminary efficacy of MIND-over-MIRROR-a novel group-based psychological intervention integrating ACT and compassion-based strategies for individuals exhibiting high levels of BDD symptomatology. The intervention consists of eight weekly sessions and one follow-up booster session, delivered in an online or hybrid format. A randomized feasibility study will be conducted to examine the intervention's acceptability, practicality, and preliminary clinical efficacy in adults aged 18 to 65 years. A multi-method assessment framework will be employed, with self-report measures collected at baseline, post-intervention, and 3-month follow-up. Additionally, participants from experimental and control groups will report on their weekly BDD symptomatology.

Participants in the intervention group who consent will also undergo computerized behavioural tasks and functional neuroimaging using functional near-infrared spectroscopy (fNIRS) to explore neural and cognitive correlates of treatment outcomes. Improvements are expected in core clinical outcomes, including BDD symptom severity, and it is hypothesized that changes in targeted psychological processes (e.g., self-compassion) will mediate these effects. This study will contribute novel and clinically relevant data regarding the feasibility and potential effectiveness of contextual behavioural therapies for BDD, with implications for both research and practice.",clinicaltrials,commitment-consistency,1,,,marion,,1
nct:NCT07045051,,Effects of Fresh Mango as a Sugar Substitute Within High and Low Glycemic Breakfasts on Postprandial Glucose and Insulin,2025,,ClinicalTrials.gov,"Large blood sugar and insulin increases after meals high in table sugar are related to risk for diabetes and heart disease. Additionally, large increases in blood sugar may also negatively impact vascular health. Previous research suggests that mango consumed in small quantities has blood sugar-lowering properties, but the evidence of this within larger, more realistic meals is limited. The investigators want to understand if replacing table sugar (sucrose) with sugar from fresh mango (which also contains fiber and plant bioactives) will lead to more favorable blood sugar, insulin, and vascular responses after eating breakfast meals. The investigators will compare the postprandial glycemic, insulinemic, and vascular response to low and high glycemic meals sweetened with either fresh mango or sucrose.",clinicaltrials,lowball,1,,,marion,,1
nct:NCT06936111,,Effect of Residual Lipid and Inflammation Risk on Atherosclerotic Plaque Progression Under Intensive Lipid-lowering Therapy in Coronary Heart Disease,2025,,ClinicalTrials.gov,"Intensive lipid-lowering therapy is a cornerstone treatment for coronary heart disease (CHD). However, coronary plaque progression persists in a subset of patients even under intensive lipid-lowering therapy, which may be associated with residual lipid and inflammatory risks. Current research in this area remains largely confined to post hoc analyses of randomized controlled trials , with a notable scarcity of prospective follow-up cohorts. The investigators propose that establishing a prospective cohort will provide more authentic insights into the associations between residual risk factors and plaque progression. In this project, the investigators aim to establish a well-characterized CHD cohort with comprehensive data collection, good compliance, and an appropriate sample size. By focusing on non-target lesions within the target vessel and utilizing intravascular ultrasound (IVUS), the investigators will investigate the impact of residual lipid and inflammatory risks on plaque progression during intensive lipid-lowering therapy.",clinicaltrials,scarcity,1,,,marion,,1
doi:10.1093/9780197786567.003.0004,10.1093/9780197786567.003.0004,Defusing Arguments in Favour of Conscientious Objection,2025,"Alberto Giubilini, Udo Schuklenk, Francesca Minerva, Julian Savulescu",Rethinking Conscientious Objection in Health Care,"Abstract
               Chapter 3 examines the main arguments put forward in the literature and public discourse for a right to conscientious objection, arguing that they do not succeed. These include arguments from reasonability, compromise, human rights, toleration, diversity, integrity, and equality of opportunity. For each of them the chapter not only highlights their strength in supporting a right of freedom of conscience in society at large but also shows their limitations in supporting the same right within a specific professional context like health care. The focus in particular is on the reasonability-based argument as it appears to be the one offering the most philosophically robust defence of a fettered right to conscientious objection, but ultimately this argument is rejected.",crossref,isolate-and-conquer,1,,,marion,,1
doi:10.5220/0014151200004942,10.5220/0014151200004942,Relation Between Loss Aversion and Human Behavior,2025,Mengyadi Liang,Proceedings of the 2nd International Conference on Applied Psychology and Marketing Management,,crossref,loss-framing,1,,,marion,,1
doi:10.1002/1878-0261.70192/v3/review1,10.1002/1878-0261.70192/v3/review1,"Review for ""Crucial parameters for precise copy number variation detection in formalin-fixed paraffin-embedded solid cancer samples""",2025,,,,crossref,precise-anchor,1,,,marion,,1
nct:NCT06269146,,Targeting Dopamine-Mediated Social Reward Sensitivity to Remediate Social Disconnection,2024,,ClinicalTrials.gov,"This study seeks to understand if the medication pramipexole improves social connectedness and functioning in adults (ages 18-50) who experience anxiety or depression. The study plans to enroll 108 participants total across two sites (University of California San Diego and New York State Psychiatric Institute). Pramipexole will be given in a 6-week randomized, double-blind, placebo-controlled trial. Social reward processing will be assessed using measures of brain function (fMRI), behavior, and self-report at baseline and week 6. Knowledge gained from this study will help determine the therapeutic potential of targeting the dopamine system to remediate social disconnection as an anxiety and depression intervention.",clinicaltrials,extreme-anchor,1,,,marion,,1
nct:NCT06567145,,Assessing the Effectiveness and Feasibility of Group-based Treatment for Self-stigma in People With Mental Disorders: a Pragmatic Multisite Randomized Controlled Trial in Routine Mental Health Services in North-east Italy,2024,,ClinicalTrials.gov,"Self-stigma refers to the internalization of negative stereotypes by individuals with mental disorders, leading to beliefs that they are dangerous, aggressive, or incapable of working. This phenomenon has harmful effects on various aspects of life, such as adherence to treatment, self-esteem, quality of life, and can increase feelings of despair and suicide risk. To address these issues, the Narrative Enhancement and Cognitive Therapy (NECT) was developed. NECT is a group-based intervention consisting of 20 sessions designed to reduce self-stigma in individuals with mental disorders.

This study aims to evaluate the efficacy and feasibility of NECT in 416 patients from 26 mental health centers in Northeast Italy. It is structured as a pragmatic, multicenter, randomized controlled trial with two parallel arms. The study will assess the impact of NECT on several psychological dimensions, including levels of self-stigma, self-esteem, hope, empowerment, perception of recovery, mental well-being, and stigma-related stress. The findings of this research are expected to contribute to the understanding of effective treatments for patients with mental disorders, particularly those burdened by high levels of self-stigma, and to improve their recovery outcomes.",clinicaltrials,trial-close,1,,,marion,,1
doi:10.2307/jj.23338166.6,10.2307/jj.23338166.6,Summary,2024,,Close to the Edge: Excavations of Five Cornish Coastal Barrows,,crossref,summary-close,1,,,marion,,1
arxiv:2303.13683v1,,OFA$^2$: A Multi-Objective Perspective for the Once-for-All Neural Architecture Search,2023,"Rafael C. Ito, Fernando J. Von Zuben",arXiv,"Once-for-All (OFA) is a Neural Architecture Search (NAS) framework designed to address the problem of searching efficient architectures for devices with different resources constraints by decoupling the training and the searching stages. The computationally expensive process of training the OFA neural network is done only once, and then it is possible to perform multiple searches for subnetworks extracted from this trained network according to each deployment scenario. In this work we aim to give one step further in the search for efficiency by explicitly conceiving the search stage as a multi-objective optimization problem. A Pareto frontier is then populated with efficient, and already trained, neural architectures exhibiting distinct trade-offs among the conflicting objectives. This could be achieved by using any multi-objective evolutionary algorithm during the search stage, such as NSGA-II and SMS-EMOA. In other words, the neural network is trained once, the searching for subnetworks considering different hardware constraints is also done one single time, and then the user can choose a suitable neural network according to each deployment scenario. The conjugation of OFA and an explicit algorithm for multi-objective optimization opens the possibility of a posteriori decision-making in NAS, after sampling efficient subnetworks which are a very good approximation of the Pareto frontier, given that those subnetworks are already trained and ready to use. The source code and the final search algorithm will be released at https://github.com/ito-rafael/once-for-all-2",arxiv,tna,1,,,marion,,1
nct:NCT05739565,,"Title Impact of a Physical Activity Intervention With Motivational Support From Peers for Prostate Cancer Patients - ACTI-PAIR 2 Multicenter, Randomized Stepped-wedge Study",2023,,ClinicalTrials.gov,"Despite the recognized benefits of physical activity in tertiary prevention, 60-70% of prostate cancer patients are insufficiently active.

Yet 150 minutes of brisk walking per week (new WHO recommendations) is associated with a 29% reduction in cancer mortality and a 57% reduction in recurrence.

Increasing patients' adherence to regular physical activity appears to be a new challenge for personalized cancer care.

Personalized physical activity programmes (1) at home, (2) supported by health professionals, or (3) by peers have shown the effectiveness of regular physical activity.

However, these interventions last less than 6 months and do not allow for long-term sustainability of physical activity.

This study proposes to combine 3 interventions, which aim to initiate and maintain regular physical activity in prostate cancer patients:

* 1-The realization of a personalized and realistic physical activity project via physical activity support devices (sport health centers)
* 2-Coaching by a peer (a patient with the same disease who has reached the WHO recommendations for physical activity), who will provide motivational follow-up
* 3-Support by health professionals (attending physician) through the prescription of physical activity.

The feasibility of ACTI-PAIR program has been demonstrated, the investigators now wish to evaluate it effectiveness.",clinicaltrials,anchor-with-range,1,,,marion,,1
nct:NCT05814822,,Targeting Insomnia to Improve Outcomes in Adults With Problematic Cannabis Use,2023,,ClinicalTrials.gov,"This study will compare the efficacy of telemedicine-delivered cognitive behavioral therapy for insomnia tailored for people using cannabis for sleep (CBTi-CB-TM) to telemedicine-delivered sleep hygiene education (SHE-TM) on sleep, cannabis use, and daytime functioning. We will also evaluate the effects of CBTi-CB-TM on fundamental sleep regulatory system - homeostatic sleep drive - and its association with clinical outcomes.",clinicaltrials,regulatory-fit,1,,,marion,,1
openalex:W4386689369,10.56570/jimgs.v2i2.123,Crisis Management skills For International Medical Graduates,2023,"Humaira Shamim, Lakshmi Sai Niharika Janga, Omobolanle A Obajeun, Simhachalam Gurugubelli, Sai Giridhar Gundepalli, Dr.FNU Twinkle",Journal For International Medical Graduates,"Crisis management is based on clarity, commitment, consistency and confidence. Strategy of Crisis intervention involves awareness, promoting compassion and implementing orders. The assessment crisis Intervention trauma model consists of assessing the affected person, establishing a relationship, understanding the problem, providing emotional support, exploring coping strategies, implementing a plan, and following up. The most common personal crisis can be a failure in exam , switching from one profession to the other, financial crisis, changing your native city or country, loss of a loved one, natural disaster or health crisis. Thinking about the crisis as a learning opportunity to become stronger through coping strategies and personal growth.",openalex,commitment-consistency,1,,,marion,,1
openalex:W4387628486,10.1145/3617072.3617108,Analysing the Influence of Loss-Gain Framing on Data Disclosure Behaviour: A Study on the Use Case of App Permission Requests,2023,"Kerstin Bongard-Blanchy, Jean-Louis Sterckx, Arianna Rossi, Anastasia Sergeeva, Vincent Koenig, Salvador Rivas, Verena Distler",,"This paper examines the effect of the dark pattern strategy “loss-gain framing” on users’ data disclosure behaviour in mobile settings. Understanding whether framing influences users’ willingness to disclose personal information is important to (i) determine if and how this technique can subvert consent and other privacy decisions, (ii) prevent abuse with appropriate policies and sanctions, and (iii) provide clear evidence-based guidelines for app privacy engineering. We conducted an online user study (N=848), in which we varied the framing of app permission requests (i.e., positive, negative, or neutral framing) and examined its impact on participants’ willingness to accept the permission, their evaluation of the trustworthiness of the request and their perception of being informed by it. Our findings reveal effects on disclosure behaviour for request types that users cannot easily understand. In this case, negative framing makes users more likely to disclose personal information. Contrary to our expectations, positive framing reduces disclosure rates, possibly because it raises users’ suspicion. We discuss implications for the design of interfaces that aim to facilitate informed, privacy-enhancing decision-making.",openalex,gain-framing,1,,,marion,,1
doi:10.1201/9781003305156-9,10.1201/9781003305156-9,Turid's case studies,2022,"Stephanie Rousseau, Turid Rugaas",How to Raise a Puppy,,crossref,puppy-dog,1,,,marion,,1
openalex:W4210343276,10.1200/jco.21.02170,Breast Cancers Are Immunogenic: Immunologic Analyses and a Phase II Pilot Clinical Trial Using Mutation-Reactive Autologous Lymphocytes,2022,"Nikolaos Zacharakis, Lutfi M. Huq, Samantha J. Seitter, Sanghyun P. Kim, Jared J. Gartner, Sivasish Sindiri, Victoria K. Hill, Yong F. Li, Biman C. Paria, Satyajit Ray, Billel Gasmi, Chyi-chia Lee, Todd D. Prickett, Maria R. Parkhurst, Paul F. Robbins, Michelle M. Langhan, Thomas E. Shelton, Anup Y. Parikh, Shoshana T. Levi, Jonathan M. Hernandez, Chuong D. Hoang, Richard M. Sherry, James C. Yang, Steven A. Feldman, Stephanie L. Goff, Steven A. Rosenberg",Journal of Clinical Oncology,"PURPOSE: Metastatic breast cancer (mBrCa) is most often an incurable disease with only modest responses to available immunotherapies. This study investigates the immunogenicity of somatic mutations in breast cancer and explores the therapeutic efficacy in a pilot trial of mutation-reactive tumor-infiltrating lymphocytes (TILs) in patients with metastatic disease. PATIENTS AND METHODS: Forty-two patients with mBrCa refractory to previous lines of treatment underwent surgical resection of a metastatic lesion(s), isolation of TIL cultures, identification of exomic nonsynonymous tumor mutations, and immunologic screening for neoantigen reactivity. Clinically eligible patients with appropriate reactivity were enrolled into one cohort of an ongoing phase II pilot trial of adoptive cell transfer of selected neoantigen-reactive TIL, with a short course of pembrolizumab (ClinicalTrials.gov identifier: NCT01174121). RESULTS: TILs were isolated and grown in culture from the resected lesions of all 42 patients with mBrCa, and a median number of 112 (range: 6-563) nonsynonymous mutations per patient were identified. Twenty-eight of 42 (67%) patients contained TIL that recognized at least one immunogenic somatic mutation (median: 3 neoantigens per patient, range: 1-11), and 13 patients demonstrated robust reactivity appropriate for adoptive transfer. Eight patients remained clinically eligible for treatment, and six patients were enrolled on a protocol of adoptive cell transfer of enriched neoantigen-specific TIL, in combination with pembrolizumab (≤ 4 doses). Objective tumor regression was noted in three patients, including one complete response (now ongoing over 5.5 years) and two partial responses (6 and 10 months). CONCLUSION: Most patients with breast cancer generated a natural immune response targeting the expressed products of their cancer mutations. Adoptive transfer of TIL is a highly personalized experimental option for patients with mBrCa shown to be capable of mediating objective responses in this pilot trial and deserves further study.",openalex,puppy-dog,1,,,marion,,1
doi:10.4324/9781003183815-5,10.4324/9781003183815-5,A foot in the door,2021,Susan Simon,School Principal Development,,crossref,fitd,1,,,marion,,1
doi:10.1007/978-3-319-52677-5_41-1,10.1007/978-3-319-52677-5_41-1,End of Trial and Close Out of Data Collection,2021,Gillian Booth,Principles and Practice of Clinical Trials,,crossref,trial-close,1,,,marion,,1
openalex:W4283271761,10.2478/boku-2021-0013,Partial budgeting for acquiring and operating a ground-based optical crop sensor for variable rate nitrogen application,2021,"Francisco Medel-Jiménez, Andreas Gronauer, Norbert Barta, Theresa Krexner, Reinhard W. Neugschwandtner, Iris Kral",Die Bodenkultur Journal of Land Management Food and Environment,"Summary Optical crop sensors for variable rate nitrogen application (VRNA) are described as an optimal solution to increase yield while minimizing fertilizer costs, although their operation and acquisition costs could be high. In this study, a partial budgeting approach was used to assess the net income of buying and operating a crop sensor for VRNA for optimizing fertilizer application to winter wheat. Two VRNA scenarios – stimulus, where crops with lower yield expectations received more fertilizer, and compensatory, where crops with higher yield expectations received less fertilizer – were assessed and compared to a conventional way of fertilizer application. Both scenarios showed negative results. The stimulus scenario showed a yearly negative change in income of −227.3 €/ha/year on 25 ha of fertilized area and −38.9 €/ha/year on 250 ha of fertilized area. In the case of the compensatory scenario, a yearly change in income of −271.8 €/ha/year on 25 ha of fertilized area and −83.3 €/ha/year on 250 ha of fertilized area was achieved. Results also showed that bigger farms had lower losses than smaller farms due to the economy of scale. Farmers may opt for sharing or leasing the use of the crop sensor to reduce costs.",openalex,assumptive,1,,,marion,,1
doi:10.5771/1611-5821-2020-6-34,10.5771/1611-5821-2020-6-34,Organspende in Deutschland: Höhere Spenderzahlen mithilfe der Disrupt-Then-Reframe-Technik?,2020,"Marie Roos, Paul Weismann",Gesundheits- und Sozialpolitik,"Um dem Organspendermangel in Deutschland zu begegnen, wurde zuletzt die Einführung der Widerspruchslösung diskutiert. Die zuständigen Behörden nehmen an, dass ein Mensch zur postmortalen Organspende bereit ist, wenn er zu Lebzeiten nicht ausdrücklich widersprochen hat. Die in Deutschland normierte Entscheidungslösung setzt auf eine bewusste, informierte Entscheidung jedes Einzelnen. Anhand der präsentierten Studie wird gezeigt, dass es mithilfe der sozialpsychologischen Disrupt-Then-Reframe-Technik möglich sein könnte, die Entscheidungslösung beizubehalten und dennoch deutlich höhere Spenderzahlen zu erreichen. ",crossref,disrupt-then-reframe,1,,,marion,,1
