id,doi,year,title,authors,journal,abstract,provenance_techniques,provenance_count,decision,decision_reason,screener
openalex:W1971601808,10.1016/s1057-7408(07)70017-7,2007,Construal Level Theory and Consumer Behavior,"Nira Liberman, Yaacov Trope, Cheryl Wakslak",Journal of Consumer Psychology,"The three commentaries on our paper “Construal Levels and Psychological Distance: Effects on Representation, Prediction, Evaluation, and Behavior” offer insightful theoretical extensions and practical applications of construal level theory (CLT). We were inspired and challenged by the commentaries to elaborate on a number of issues, although our elaboration more often raises questions and speculations than provides definite answers. Owing to space limitations, however, we could discuss only some of the issues raised in the commentaries. The first set of issues concerns our theoretical framework, namely, similarities and differences among distance dimensions, the question of additional distances, the nature of the interaction among distances, and the relationship between psychological distance and construct of stimulus information sampling. The second set of issues concerns applications of CLT to consumer choice, namely, how to make better decisions, the nature of regret, and how people construct and process choice sets.",concrete-construal,1,include,J Consumer Psych 2007 elaboration of CLT for consumer behavior; eligible (theoretical-empirical synthesis applied to consumer decisions).,llm-claude-opus-4-7
openalex:W2007576031,10.1016/s1057-7408(07)70013-x,2007,"Construal Levels and Psychological Distance: Effects on Representation, Prediction, Evaluation, and Behavior","Yaacov Trope, Nira Liberman, Cheryl Wakslak",Journal of Consumer Psychology,"Construal level theory (CLT) is an account of how psychological distance influences individuals' thoughts and behavior. CLT assumes that people mentally construe objects that are psychologically near in terms of low-level, detailed, and contextualized features, whereas at a distance they construe the same objects or events in terms of high-level, abstract, and stable characteristics. Research has shown that different dimensions of psychological distance (time, space, social distance, and hypotheticality) affect mental construal and that these construals, in turn, guide prediction, evaluation, and behavior. The present paper reviews this research and its implications for consumer psychology.",concrete-construal,1,include,J Consumer Psych 2007 Trope & Liberman CLT review with consumer-behavior application; eligible (synthesis of empirical construal literature with consumer-decision applications).,llm-claude-opus-4-7
openalex:W1983312969,10.1086/592131,2008,Effects of Temporal and Social Distance on Consumer Evaluations: Table 1,"Kyeongheui Kim, Zhang Meng, Xiuping Li",Journal of Consumer Research,"This article investigates how two dimensions of psychological distance (i.e., temporal distance and social distance) jointly affect consumers' evaluations of products. Drawing on the properties of psychological distance and diminishing sensitivity to the increase in distance, we show an interaction effect of the two distance dimensions on product evaluations in two experiments. Specifically, when both dimensions are proximal, consumer evaluations are more influenced by the value associated with low-level construals than when either or both dimensions are distal, where consumer evaluations are more influenced by the value associated with high-level construals. (c) 2008 by JOURNAL OF CONSUMER RESEARCH, Inc..",concrete-construal,1,include,J Consumer Research 2008 two experiments on temporal × social distance for consumer product evaluations; eligible.,llm-claude-opus-4-7
openalex:W2035960644,10.1037/a0017879,2010,"Now you see it, now you don't: Interests, issues, and psychological distance in integrative negotiation.","Mauro Giacomantonio, Carsten K. W. De Dreu, Lucia Mannetti",Journal of Personality and Social Psychology,"Negotiators are often advised to seek win-win agreements by focusing on interests (primary features) rather than issues (secondary features), but whether such advice is valid remains to be seen. Consistent with construal level theory (Y. Trope & N. Liberman, 2003), Experiments 1 and 2 show that negotiators focus on secondary features (issues) more than on primary features (interests) when psychological distance is low rather than high, and concomitant construal level is local and specific rather than global and abstract. Experiment 3 showed that high construal level promoted problem-solving behavior and therefore facilitated the achievement of win-win agreement, but only when integrative potential resided in underlying interests; when integrative potential resided in the issues, low construal level negotiators achieved higher joint outcomes. Thus, both low- and high-construal negotiators may achieve win-win agreements when such agreements require trade-offs at the level of issues, or at the level of underlying interests, respectively.",concrete-construal,1,include,"JPSP 2010 experiments on psychological distance × negotiation interests-vs-issues focus; eligible (experimental, construal, negotiation outcome).",llm-claude-opus-4-7
openalex:W2146450727,10.1016/j.jesp.2010.05.001,2010,Psychological distance boosts value-behavior correspondence in ultimatum bargaining and integrative negotiation,"Mauro Giacomantonio, Carsten K. W. De Dreu, Shaul Shalvi, Daniel Sligte, Susanne Leder",Journal of Experimental Social Psychology,,concrete-construal,1,include,"JESP 2010 on psychological distance × value-behavior correspondence in ultimatum bargaining and integrative negotiation; eligible (experimental, negotiation outcome).",llm-claude-opus-4-7
openalex:W2144479840,10.1086/659874,2011,Psychological Distance and the Dual Role of Price,"Torsten Bornemann, Christian Homburg",Journal of Consumer Research,"Abstract When evaluating a product, consumers may interpret price information as either an indicator of quality or an indicator of monetary sacrifice. On the basis of construal level theory, we propose that psychological distance alters the weight consumers attach to these opposing roles of price. Four experiments show (1) that from both a temporally and a socially distant perspective, the price–perceived quality relationship is more pronounced; (2) that from a temporally proximal perspective, the price–perceived sacrifice relationship is more pronounced; (3) that these effects stem from differences in the way consumers mentally construe price information; and (4) that when people initially use price to judge a product for distant future consumption, it receives less attention as an indicator of sacrifice in a later evaluation for near future consumption. These findings have implications for prelaunch communication activities and preference elicitation methods such as conjoint analysis.",concrete-construal,1,include,"J Consumer Research 2011 four experiments on psychological distance × price interpretation; eligible (experimental, construal, consumer-decision outcome including price).",llm-claude-opus-4-7
openalex:W3124122148,10.1086/665047,2012,Choosing Here and Now versus There and Later: The Moderating Role of Psychological Distance on Assortment Size Preferences,"Joseph K. Goodman, Selin A. Malkoc",Journal of Consumer Research,"Abstract Consumers prefer larger assortments, despite the negative consequences associated with choosing from these sets. This article examines the role of psychological distance (temporal and geographical) in consumers’ assortment size decisions and rectifies contradicting hypotheses produced by construal level theory. Six studies demonstrate that while consumers prefer larger assortments when the choice takes place in the here and now, they are more likely to prefer small assortments when choices pertain to distant locations and times. This decrease in preference for large assortments is due to psychological distance increasing the similarity of the options in a category, making them appear more substitutable. This effect of psychological distance reverses when consumers consider desirability/feasibility trade-off information inherent in the assortment size decision. These findings point to important outcomes of psychological distance, resolving opposing predictions of construal level theory, and identify boundary conditions for the well-established notion that consumers are attracted to large assortments.",concrete-construal,1,include,"J Consumer Research 2012 six studies on psychological distance × assortment size preferences; eligible (experimental, construal, consumer-choice outcome).",llm-claude-opus-4-7
openalex:W2091277221,10.1086/674212,2013,The Distinct Affective Consequences of Psychological Distance and Construal Level,"Lawrence E. Williams, Randy Stein, Laura Galguera",Journal of Consumer Research,"Much of the existing literature on psychological distance has focused on cognitive outcomes, such as changes in construal level, largely framing affective processes out of the discussion. The current research examines the distinct influences of psychological distance and construal level on affect-based evaluation. In a first set of experiments, psychological distance (vs. closeness) reduces the intensity of felt affect, while abstract (vs. concrete) thinking increases the positivity of one's thoughts. In a second set of experiments, psychological distance improves evaluations of negative experiences by reducing the intensity of negative affect but hurts evaluations of positive experiences by reducing the intensity of positive affect. By contrast, abstract thinking increases positivity, improving evaluations for both positive and negative experiences alike. These findings have implications for marketing communication strategy and existing theories of psychological distance.",concrete-construal,1,include,"J Consumer Research 2013 experiments on psychological distance × construal level on affect-based evaluation; eligible (experimental, construal manipulation, consumer-evaluation outcome).",llm-claude-opus-4-7
openalex:W2111233167,10.1037/bul0000005,2014,The effects of psychological distance on abstraction: Two meta-analyses.,"Courtney K. Soderberg, Shannon Callahan, Annie O. Kochersberger, Elinor Amit, Alison Ledgerwood",Psychological Bulletin,"Psychological distance and abstraction both represent key variables of considerable interest to researchers across cognitive, social, and developmental psychology. Moreover, largely inspired by construal level theory, numerous experiments across multiple fields have now connected these 2 constructs, examining how psychological distance affects the level of abstraction at which people mentally represent the world around them. The time is clearly ripe for a quantitative synthesis to shed light on the relation between these constructs and investigate potential moderators. To this end, we conducted 2 meta-analyses of research examining the effects of psychological distance on abstraction and its downstream consequences. Across 106 papers containing a total of 267 experiments, our results showed a reliable and medium-sized effect of psychological distance on both level of abstraction in mental representation and the downstream consequences of abstraction. Importantly, these effects replicate across time, researchers, and settings. Our analyses also identified several key moderators, including the size of the difference in distance between 2 levels of a temporal distance manipulation and the dependent variable's capacity to tap processing of both abstract and concrete features (rather than only one or the other). We discuss theoretical and methodological implications, and highlight promising avenues for future research.",concrete-construal,1,include,Psychological Bulletin 2014 two meta-analyses on psychological distance × abstraction; eligible (meta-analysis of construal-level primary literature).,llm-claude-opus-4-7
openalex:W2345138829,10.1016/j.jcps.2016.03.001,2016,Effects of multiple psychological distances on construal and consumer evaluation: A field study of online reviews,"Ni Huang, Gordon Burtch, Yili Hong, Evan Polman",Journal of Consumer Psychology,"Abstract Through a large‐scale field study of 166,215 online restaurant reviews, we found evidence of a distance boosting effect, whereby experiencing spatial distance (i.e., authoring a review about a geographically distant restaurant, rather than proximate one) and temporal distance (i.e., authoring a review after a lengthy delay, rather than immediately) jointly affect review positivity by amplifying consumers' high‐level construals. Although past research has explored the relationship between psychological distance, construal and consumer evaluation, the effects of various dimensions of distance have only been considered in isolation. Our research contributes to past work by testing the effects of experiencing two dimensions of psychological distance simultaneously on construal and consumer evaluations. Moreover, because our data contain naturalistic observations, our research includes a wide range of temporal and spatial distances. We found that the effect of one distance increases the effect of the other. Metaphorically speaking, the effect of one distance is boosted by another.",concrete-construal,1,include,"J Consumer Psych 2016 field study N=166,215 online reviews × psychological distance; eligible (experimental, construal, consumer-evaluation outcome).",llm-claude-opus-4-7
openalex:W2614813011,10.1093/jcr/ucx070,2017,So Close I Can Almost Sense It: The Interplay between Sensory Imagery and Psychological Distance,"Ryan Elder, Ann E. Schlosser, Morgan Poor, Lidan Xu",Journal of Consumer Research,"Across the five sensory modalities we examine an unexplored difference in imagery: psychological distance. In particular, we propose that imagined senses can be psychologically more proximal or distal based on the maximum physical distance typically required for a stimulus to be sensed. Specifically, we propose that imagined senses that require close proximity to the body in order to be sensed (i.e., taste, touch) will feel more psychologically proximal than senses that do not require such close proximity (i.e., hearing, sight). We obtain support for our theoretical framework across a pilot study, four lab studies, and one field study by examining how images evoked using different sensory modalities differentially influence variables shown in past research to vary along psychological distance: (1) the imagined distance between the consumer and the stimulus, (2) product perceptions on other dimensions of psychological distance, and (3) persuasion when matched with other dimensions of psychological distance.",concrete-construal,1,include,"J Consumer Research 2017 five studies on sensory imagery × psychological distance × consumer evaluations; eligible (experimental, construal mechanism, consumer outcome).",llm-claude-opus-4-7
openalex:W2799548047,10.1080/00913367.2018.1452654,2018,The Impact of Psychological Distance and Construal Level on Consumers' Responses to Taboos in Advertising,"Ioannis Theodorakis, Grigorios Painesis",Journal of Advertising,"To date, the use of taboos in advertising has produced mixed results. Such discrepancies require explanation. Relying on construal-level theory and the concept of psychological distance, this research focuses on taboo ads' effects on consumers' responses. The findings from three studies show that for different product categories (Study 1: perfume; Studies 2 and 3: alcohol) and across different taboo types (sex, violence, and a mixture of sex and violence), different distance dimensions (Study 1: spatial; Study 2: social), and different construal-level manipulations (low, high), an increase in the psychological distance (or construal) level attenuates consumers' unfavorable attitudinal and behavioral reactions while a decrease in the psychological distance (or construal) level intensifies consumers' responses. Furthermore, response intensity varies depending on the taboo type used, such that both violent and mixed taboo types produce more negative responses. Finally, gender has an impact, such that women react more negatively than men to different taboos, both across distance dimensions and across distance (construal) levels. A discussion of these findings and their implications, as well as suggestions for future research, concludes the article.",concrete-construal,1,include,"J Advertising 2018 three studies on construal-level theory + psychological distance for taboo ads (perfume, alcohol); eligible (experimental, construal manipulation, consumer-response outcomes).",llm-claude-opus-4-7
openalex:W2915008833,10.1017/s1930297500008731,2018,How far is the suffering? The role of psychological distance and victims’ identifiability in donation decisions,"Tehila Kogut, Ilana Ritov, Enrico Rubaltelli, Nira Liberman",Judgment and Decision Making,"Abstract We are regularly told about people at various locations around the globe, both near and far, who are in distress or in dire need. In the present research, we examined how the prospective donor’s psychological distance from a given victim may interact with the victim’s identification to determine the donor’s willingness to accede to requests for donations to help the victim in question. In three studies, we measured willingness to donate (Studies 1 &amp; 2) and actual donations (Study 3) to identified or unidentified victims, while measuring (Study 1) or manipulating (Studies 2 &amp; 3) the psychological distance between prospective donors and the recipients. Results indicate that increasing the psychological distance between prospective donors and victims decreases willingness to help — but only when the victims are unidentified, not when they are identified. This suggests that victim’s identification mitigates the effect of distance on donor’s willingness to help.",concrete-construal,1,include,"Judgment and Decision Making 2018 three studies on psychological distance × victim identifiability for donation willingness; eligible (experimental, donation outcome per §4.4, construal mechanism).",llm-claude-opus-4-7
openalex:W2916363439,10.1108/jpbm-08-2018-2004,2019,The impact of envy on brand preference: brand storytelling and psychological distance as moderators,Danny Tengti Kao,Journal of Product & Brand Management,"Purpose While envy has been widely explored in psychology literature, theoretical understanding of the effects of envy on consumers’ emotional responses to brands is promising but under explored. Therefore, this study aims to apply cases of envy and psychological distance to consumers to examine whether the style of brand storytelling can moderate brand preference. Design/methodology/approach Three experimental studies were conducted to test the hypotheses. Experiment 1 investigated the effect of envy on consumer evaluations of an advocated brand, through viewing a series of advertisements that varied in brand storytelling styles. A total of 104 working students were randomly assigned to a 2 (brand storytelling: underdog vs top dog) single factorial design. Experiment 2 investigates the effect of envy on consumer evaluations of the advocated brand through viewing advertisements that varied in psychological distance. A total of 108 working students were randomly assigned to a 2 (psychological distance: proximal vs distant) single factorial design. Experiment 3 investigated the effect of envy on evaluations of the brand through viewing advertisements that varied in brand storytelling style and psychological distance. A total of 208 working students were randomly assigned to a 2 (underdog vs top dog) × 2 (proximal vs distant psychological distance) between-subject factorial design. Findings Results demonstrate that for consumers experiencing benign and malicious envy, advertisements characterized by brand storytelling (underdog vs top dog) and psychological distance (proximal vs distant) will elicit differential brand preferences. Originality/value This research takes up the call to address the limited attention given to envy in the context of brand advertising. Specifically, this research aims to explore how consumer envy influences brand preference and the role of moderating effects such as brand storytelling and psychological distance in this context.",concrete-construal,1,include,J Product & Brand Management 2019 on envy × brand storytelling × psychological distance for brand preference; eligible.,llm-claude-opus-4-7
openalex:W2917978880,10.3389/fpsyg.2019.00230,2019,Climate Change From a Distance: An Analysis of Construal Level and Psychological Distance From Climate Change,"Susie Wang, Mark J. Hurlstone, Zoe Leviston, Iain Walker, Carmen Lawrence",Frontiers in Psychology,"= 319), we tested whether construal level and psychological distance from climate change predicted pro-environmental intentions and policy support, and whether manipulating distance and construal increased pro-environmental behaviors such as donations. Results showed that psychological closeness to climate change predicted more engagement in pro-environmental behaviors, while construal level produced inconsistent results, and manipulations of both variables failed to produce increases in pro-environmental behaviors. In contrast with the central tenet of construal level theory, construal level was unrelated to psychological distance in all three studies. Our findings suggest that the hypothesized relationship between construal level and psychological distance may not hold in the context of climate change, and that it may be difficult to change pro-environmental behavior by manipulating these variables.",concrete-construal,1,include,Frontiers in Psychology 2019 N=319 study on psychological distance from climate change × donation behavior; eligible (donation outcome per §4.4).,llm-claude-opus-4-7
openalex:W2944321252,10.1080/02650487.2019.1607649,2019,Text versus pictures in advertising: effects of psychological distance and product type,"Yung Kyun Choi, Sukki Yoon, Kacy Kim, Yeonshin Kim",International Journal of Advertising,"The authors examine effects of marketing messages that use text or pictures for advertising durable or nondurable products appealing to consumers’ perceptions of close versus far psychological distance. In three studies, ads featuring text (pictures) evoke more favourable attitudes and purchase intentions toward products to be purchased in the distant (close) future or at a distant (close) location. In addition, ads featuring text (pictures) evoke more favourable attitudes and purchase intentions for durable (nondurable) goods. The research shows that marketers will be most persuasive if they ensure congruence among message formats, product types, and psychological distance.",concrete-construal,1,include,"Int J Advertising 2019 three studies on text vs pictures in ads × construal level × product type for attitudes/purchase intentions; eligible (experimental, construal, purchase-intention outcome).",llm-claude-opus-4-7
openalex:W2982174257,10.1177/0047287519880000,2019,"The Interplay of Travelers’ Psychological Distance, Language Abstraction, and Message Appeal Type in Social Media Advertising","Saerom Wang, Xinran Lehto",Journal of Travel Research,"Effectiveness of destination advertising to potential tourists has been enhanced with the use of personalized orientation. After an online search for information about a destination, individuals are exposed to advertisements related to the destination on their social media newsfeed. However, further understanding is warranted in terms of how these destination messages should be crafted. Thus, our research aims to uncover how destination advertising design, message appeal type, and language abstraction level interact with a message recipient’s psychological distance to his or her trip to influence consumer response to the advertising. Based on construal level theory, we conducted a scenario-based experiment, using manipulated messages and psychological distance state to assess message effectiveness. The findings show that the type of message design respondents favor can vary either by perceived temporal distance to their travel plans or spatial distance to the travel destination.",concrete-construal,1,include,"J Travel Research 2019 on traveler psychological distance × language abstraction × message-appeal type in social-media ads; eligible (experimental, construal × framing, ad-effectiveness outcome).",llm-claude-opus-4-7
