id,doi,year,title,authors,journal,abstract,provenance_techniques,provenance_count,decision,decision_reason,screener
openalex:W3110752310,10.1177/0022242920984492,2020,They’re Just Not That into You: How to Leverage Existing Consumer–Brand Relationships Through Social Psychological Distance,"Scott Connors, Mansur Khamitov, Matthew Thomson, Andrew Perkins",Journal of Marketing,"While prevailing marketing practice is to encourage ever-stronger relationships between consumers and brands, such relationships are rare, and many consumers are relationship-averse or content with the status quo. The authors examine how marketers can more effectively manage existing brand relationships by focusing on the psychological distance between consumers and brands in order to match close (distant) brands with concrete (abstract) language in marketing communications. Through such matching, marketers can create a beneficial mindset-congruency effect leading to more favorable evaluations and behavior, even for brands that are relatively distant to consumers. Study 1 demonstrates the basic mindset-congruency effect, and Study 2 shows that it is capable of affecting donation behaviors. Study 3 documents two brand-level factors (search vs. experience goods, brand stereotypes) that moderate this effect in managerially relevant ways. Study 4 shows that activation of the mindset-congruency effect influences consumers to spend more and that these behaviors are moderated by consumer category involvement. The authors conclude with marketing and theoretical implications.",concrete-construal,1,include,"J Marketing 2020 multiple studies on consumer-brand psychological distance × concrete/abstract language matching; eligible (experimental, construal, consumer-brand outcome).",llm-claude-opus-4-7
openalex:W3196173612,10.1080/13527266.2021.1969588,2021,Should businesses take a stand? Effects of perceived psychological distance on consumers’ expectation and evaluation of corporate social advocacy,"Hao Xu, Eugene Lee, Hyejoon Rim",Journal of Marketing Communications,"Nowadays companies are increasingly engaging in social-political issues. In light of the Construal Level Theory, this study examined the polarizing/depolarizing effects of perceived psychological distance on consumers’ expectation of corporate social advocacy and evaluations among consumers from different partisan identities. A between-subjects experiment (N = 296) with a continuous independent variable – perceived psychological distance – was employed. The study found that consumers with a closer perceived psychological distance to the company tended to have a higher expectation of corporate social advocacy. However, perceptions of psychological distance resulted in mixed effects regarding people’s attitudes and buycott/boycott intentions, where consumer-company identification mediated these relationships. Theoretical and practical implications are discussed.",concrete-construal,1,include,J Marketing Communications 2021 N=296 between-subjects experiment on psychological distance × corporate social advocacy on consumer expectation/evaluation; eligible.,llm-claude-opus-4-7
openalex:W3210019465,10.1080/02650487.2021.1982529,2021,AI-powered recommendations: the roles of perceived similarity and psychological distance on persuasion,"Jungyong Ahn, Jungwon Kim, Yongjun Sung",International Journal of Advertising,"Artificial intelligence (AI) plays various roles in our daily lives, such as personal assistant, salesperson, and virtual counselors; thus, it stands out in various fields as a recommendation agent. This study explored the effects of perceived similarity and psychological distance on the persuasion of AI recommendation agents through two experiments. Results of Experiment 1 elucidated that individuals feel more psychologically distant when they interact with AI recommendation agents than with human agents as a result of a different level of perceived similarity. Furthermore, psychological distance plays a mediating role in determining the effectiveness of desirability- vs. feasibility-focused messages in health-related issues. In Experiment 2, we manipulated the AI speaker's level of perceived similarity via anthropomorphism and found that the AI's recommendation with secondary (vs. primary) features is more effective when AI is humanized, and the reverse was found in non-humanized AI conditions. Both theoretical and managerial implications are provided.",concrete-construal,1,include,"Int J Advertising 2021 two experiments on AI recommendation × perceived similarity × psychological distance for persuasion; eligible (experimental, construal, persuasion outcome in commercial setting).",llm-claude-opus-4-7
openalex:W4306929524,10.1108/itp-02-2022-0091,2022,"Consumers' purchase intentions in social commerce: the role of social psychological distance, perceived value, and perceived cognitive effort",Xue Yang,Information Technology and People,"Purpose Electronic word-of-mouth (eWOM) has become one of the most influential information sources for consumers' purchase decision-making. Based on construal-level theory and from the perspective of cognitive effort, this study investigated the effects of eWOM social media types and conflicting eWOM on consumers' purchase intentions and validated the mediation role of social psychological distance, perceived value, and perceived cognitive effort. Design/methodology/approach Two scenario-based experiments were conducted to validate the research model. Specifically, a 2 (eWOM social media type: strong-tie vs weak-tie) × 2 (conflicting eWOM: with vs without) between-subjects design was used. ANOVA, multiple regression analysis with PROCESS, and partial least squares (PLS) were employed to test the hypotheses. Findings The results showed that eWOM social media types had significant effects on both social psychological distance and perceived value. The significant chain mediating effects of social psychological distance and perceived value between eWOM social media types and consumers' purchase intentions were found. In addition, conflicting eWOM had significant effects on both perceived value and perceived cognitive effort. Indirect effects of conflicting eWOM on purchase intention through perceived cognitive effort were discovered. Originality/value These results contribute to the eWOM literature by investigating the influences of eWOM social media types and conflicting eWOM on consumers' purchase intentions. They also contribute to construal-level theory by extending its applicability to the field of eWOM.",concrete-construal,1,include,Information Technology and People 2022 on consumers' purchase intentions in social commerce × psychological distance × cognitive effort; eligible.,llm-claude-opus-4-7
doi:10.3389/fpsyg.2023.1166092,10.3389/fpsyg.2023.1166092,2023,The effect of partitioned framing vs. all-inclusive framing of donation amount on prosocial behavior: focus on the moderation effect of psychological characteristics,"Eun Young Lee, Kyounghee Chu",Frontiers in Psychology,"Despite numerous studies on individual charitable donations and cause-related marketing have been conducted, the framing of the donation amount has not been studied. This research suggests that people's intention to donate to charity differs depending on whether the donation amount is framed as all-inclusive or partitioned. The main effect of partitioned framing was moderated by individual differences in the need for cognition and regulatory focus. The results of our research are threefold. First, people responded more positively to engage in prosocial behavior in the partitioned donation amount condition than in the all-inclusive condition, even when the total amounts were the same. Second, the framing effect of the donation amount differed according to the need for cognition. Individuals with a high need for cognition (NFC) had a higher intention to donate in the partitioned donation amount condition than in the all-inclusive condition, while individuals with low NFC did not show differences in either condition. Third, the framing effect of the donation amount differed according to regulatory focus. Prevention-focused individuals were more willing to donate in the partitioned condition than in the all-inclusive condition, while promotion-focused individuals did not show differences in either condition. In addition, the interaction of framing and regulatory focus on donation intention was mediated by the perceived authenticity of the donation organization. This research has several academic and practical implications for effective corporate social responsibility activities.",concrete-construal,1,include,"Frontiers in Psychology 2023 on partitioned vs all-inclusive framing × donation × psychological characteristics; eligible (experimental, framing, donation outcome).",llm-claude-opus-4-7
openalex:W4401871540,10.1016/j.jbusres.2024.114916,2024,The role of psychological distance and construal level in explaining the effectiveness of human-like vs. cartoon-like virtual influencers,"Claudia Franke, Andrea Groeppel‐Klein",Journal of Business Research,"• Human-like VIs are associated with higher trustworthiness, while cartoon-like VIs are perceived more novel. • Psychological distance is greater towards a cartoon-like than a human-like VI. • Psychological distance reduces trustworthiness and strengthens novelty perception. • Message focus on desirability aspects can enhance the positive effect of psychological distance on novelty. • Once consumers become accustomed to cartoon-like VIs, they no longer evoke higher novelty. Computer-generated virtual influencers (VIs) are increasingly used in advertising as there are many advantages. In four experimental studies, two types of VIs and their impact on advertising effectiveness are compared. Key findings are that highly human-like VIs lead to higher trustworthiness, while a more cartoon-like appearance increases novelty. The reasoning behind the varying evaluation of VI types is explored through the lens of psychological distance and construal level theory, suggesting that appropriate message focus enhances the influencers’ benefits as a moderator. It is further shown that different cultural settings play an important role for VI perception, finding that the cartoon-influencer’s novelty effect is restricted to consumer groups low in VI familiarity. The studies contribute to the growing literature on VI effectiveness, delivering a theoretical underpinning for their assessment. Managerially, it is concluded that both cartoon-like and human-like VIs can be successful endorsers, but under careful consideration of various factors.",concrete-construal,1,include,"J Business Research 2024 experiment on virtual influencers × psychological distance × trustworthiness; eligible (experimental, construal, consumer-perception outcome).",llm-claude-opus-4-7
doi:10.1002/nvsm.70005,10.1002/nvsm.70005,2025,Is Concrete Framing More Effective in Enticing Donations? The Impacts of Donation Requests and Identified Beneficiary on the Effectiveness of Concrete Framing,Yingyang Zhang,Journal of Philanthropy,"ABSTRACT
                  Previous research has shown that concrete‐framed fundraising goals are more effective at eliciting donations. This study extends these findings by exploring the boundaries of the concrete framing effect. Across three experiments, our results indicate that concrete framing positively influences donations by enhancing message elaboration, which in turn increases empathy and, consequently, willingness to donate. However, the impact of this framing is moderated by the size of the donation request and the identification of the beneficiary. These findings provide valuable insights for charities and nonprofits on how to craft fundraising messages that maximize cognitive and emotional engagement with potential donors.",concrete-construal,1,include,"Journal of Philanthropy 2025 three experiments on concrete framing × donation effectiveness; eligible (experimental, construal framing, donation outcome).",llm-claude-opus-4-7
doi:10.3390/jtaer20020130,10.3390/jtaer20020130,2025,Concrete or Abstract? The Impact of Green Advertising Appeals and Information Framing on Consumer Responses,"Jiahong Yu, Xixiang Sun, Ying Huang, Yige Jia",Journal of Theoretical and Applied Electronic Commerce Research,"Green advertising messages often face challenges of abstraction and outcome ambiguity. To address this, we apply the framing effect theory to explore how concrete versus abstract expressions in green advertising interact with consumer perceptions. Drawing on the Stereotype Content Model (SCM), we propose a congruence framework: concrete messages align with competence appeals, while abstract messages align with warmth appeals. Through two experiments, we demonstrate that such congruence significantly enhances green purchase intention. Experiment 1 establishes the interaction effect between message framing (concrete vs. abstract) and appeal type (competence vs. warmth), revealing that concrete–competence and abstract–warmth pairings outperform mismatched conditions. Experiment 2 further validates advertising attitudes as a mediator and product involvement as a moderator, clarifying boundary conditions. These findings advance the theoretical understanding of framing effects in sustainability communication and offer actionable strategies for marketers: aligning message specificity (concrete/abstract) with appeal dimensions (competence/warmth) can amplify consumer engagement, particularly when tailored to product contexts.",concrete-construal,1,include,"J Theoretical and Applied Electronic Commerce 2025 two experiments on concrete vs abstract green ad messages × consumer responses; eligible (experimental, construal, consumer-response outcome).",llm-claude-opus-4-7
